id,submission_time,view_number,vote_number,title,message,image
98556491-38cf-4f30-aeb6-fe10e2e8a0f1,2020-05-29 00:37:21.475152,3,354,Our week,How was our week?,mario.png
54bd7ee5-da74-48a0-a0ad-ad8d80987e82,2020-05-29 00:39:41.431849,4,3,Negative things,What caused you difficulty this week?,koala.png
b40c52bf-6566-4cf6-9159-1ffe1b871545,2020-05-29 00:41:43.083033,2,300,Some Code,Could you show me a little code snippet?,maki.jpg
4e29de7b-2054-4bb5-9267-136bde772eba,2020-05-29 00:30:44.116603,1,500,Heroes,Who are the heroes of CodeCool?,heroeslogo.jpg
500f4f18-d939-4b81-a52b-6cc5942f5c82,2020-05-29 01:02:46.198225,0,0,Tasty,What is the most delicious thing?,furacica.png
2ee4f671-fc88-450c-9c63-78436235b648,2020-05-29 01:08:41.713461,0,0,MAGIC BUTTON,WHAT IS THE MAGIC BUTTON GOOD FOR?,cica.jpg
